<?xml version="1.0" encoding="utf-8"?>
<xs:schema id="ComponentNetwork" xmlns="" xmlns:xs="http://www.w3.org/2001/XMLSchema" xmlns:msdata="urn:schemas-microsoft-com:xml-msdata">
  <xs:element name="Interface">
    <xs:complexType>
      <xs:attribute name="name" type="xs:string" />
    </xs:complexType>
  </xs:element>
  <xs:element name="ComponentNetwork" msdata:IsDataSet="true" msdata:Locale="en-US">
    <xs:complexType>
      <xs:choice minOccurs="0" maxOccurs="unbounded">
        <xs:element ref="Interface" />
        <xs:element name="ComponentDeclarations">
          <xs:complexType>
            <xs:sequence>
              <xs:element name="Component" minOccurs="0" maxOccurs="unbounded">
                <xs:complexType>
                  <xs:sequence>
                    <xs:element name="ProvidedInterfaces" minOccurs="0" maxOccurs="unbounded">
                      <xs:complexType>
                        <xs:sequence>
                          <xs:element ref="Interface" minOccurs="0" maxOccurs="unbounded" />
                        </xs:sequence>
                      </xs:complexType>
                    </xs:element>
                    <xs:element name="RequiredInterfaces" minOccurs="0" maxOccurs="unbounded">
                      <xs:complexType>
                        <xs:sequence>
                          <xs:element ref="Interface" minOccurs="0" maxOccurs="unbounded" />
                        </xs:sequence>
                      </xs:complexType>
                    </xs:element>
                    <xs:element name="Parameters" minOccurs="0" maxOccurs="unbounded">
                      <xs:complexType>
                        <xs:sequence>
                          <xs:element name="Parameter" minOccurs="0" maxOccurs="unbounded">
                            <xs:complexType>
                              <xs:attribute name="name" type="xs:string" />
                            </xs:complexType>
                          </xs:element>
                        </xs:sequence>
                      </xs:complexType>
                    </xs:element>
                  </xs:sequence>
                  <xs:attribute name="id" type="xs:string" />
                  <xs:attribute name="type" type="xs:string" />
                  <xs:attribute name="plugin" type="xs:string" />
                </xs:complexType>
              </xs:element>
            </xs:sequence>
          </xs:complexType>
        </xs:element>
        <xs:element name="ApplicationDescription">
          <xs:complexType>
            <xs:sequence>
              <xs:element name="ComponentInstances" minOccurs="0" maxOccurs="unbounded">
                <xs:complexType>
                  <xs:sequence>
                    <xs:element name="Instance" minOccurs="0" maxOccurs="unbounded">
                      <xs:complexType>
                        <xs:sequence>
                          <xs:element name="ParameterValues" minOccurs="0" maxOccurs="unbounded">
                            <xs:complexType>
                              <xs:sequence>
                                <xs:element name="assing" minOccurs="0" maxOccurs="unbounded">
                                  <xs:complexType>
                                    <xs:attribute name="parameter" type="xs:string" />
                                    <xs:attribute name="value" type="xs:string" />
                                  </xs:complexType>
                                </xs:element>
                              </xs:sequence>
                            </xs:complexType>
                          </xs:element>
                        </xs:sequence>
                        <xs:attribute name="instanceName" type="xs:string" />
                        <xs:attribute name="componentID" type="xs:string" />
                        <xs:attribute name="config" type="xs:string" />
                      </xs:complexType>
                    </xs:element>
                  </xs:sequence>
                </xs:complexType>
              </xs:element>
              <xs:element name="InterfaceConnections" minOccurs="0" maxOccurs="unbounded">
                <xs:complexType>
                  <xs:sequence>
                    <xs:element name="Connect" minOccurs="0" maxOccurs="unbounded">
                      <xs:complexType>
                        <xs:attribute name="interface" type="xs:string" />
                        <xs:attribute name="providedBy" type="xs:string" />
                        <xs:attribute name="requiredBy" type="xs:string" />
                      </xs:complexType>
                    </xs:element>
                  </xs:sequence>
                </xs:complexType>
              </xs:element>
            </xs:sequence>
          </xs:complexType>
        </xs:element>
      </xs:choice>
    </xs:complexType>
  </xs:element>
</xs:schema>