<?xml version="1.0" encoding="utf-8"?>
<ComponentNetwork xmlns:xsi="http://www.w3.org/2001/XMLSchema-instance" xsi:noNamespaceSchemaLocation="ComponentNetwork.xsd">

    <!-- COMPONENT DECLARATION -->
  <ComponentDeclarations>
    <Component  id="idRemoteCharacterEmbodiment3DSpark"  type="RemoteCharacterEmbodiment3DSpark" plugin="libRemoteCharacterEmbodiment3DSpark.so">
      <ProvidedInterfaces>
        <Interface name="IFaceExpression" />
      </ProvidedInterfaces>
      <ProvidedInterfaces>
        <Interface name="IEyes" />
      </ProvidedInterfaces>
      <ProvidedInterfaces>
        <Interface name="INeck" />
      </ProvidedInterfaces>
      <ProvidedInterfaces>
        <Interface name="IAnimation" />
      </ProvidedInterfaces>
	  <ProvidedInterfaces>
        <Interface name="IConcurrent" />
      </ProvidedInterfaces>
	  <ProvidedInterfaces>
        <Interface name="IAsyncFatalErrorHandler" />
      </ProvidedInterfaces>
	  <ProvidedInterfaces>
        <Interface name="IApplication" />
      </ProvidedInterfaces>
	  <ProvidedInterfaces>
        <Interface name="IEventQueue" />
      </ProvidedInterfaces>
      <ProvidedInterfaces>
        <Interface name="IFrameEventPublisher" />
      </ProvidedInterfaces>
      <RequiredInterfaces>
	<Interface name="IAudioQueue" />
	<Interface name="IAsyncFatalErrorHandler" />
	<Interface name="IControlVoice" />
      </RequiredInterfaces>
    </Component>

    <Component id="idRemoteFliteVoiceSpark"  type="RemoteFliteVoiceSpark" plugin="libRemoteFliteVoiceSpark.so">
      <ProvidedInterfaces>
	<Interface name="IVoice" />
	<Interface name="IAudioQueue" />
      </ProvidedInterfaces>
    </Component>

	
    <Component id="idEyeContactSpark"  type="EyeContactSpark" plugin="libEyeContactSpark.so">
      <ProvidedInterfaces>
        <Interface name="IDetectedFacePositionConsumer" />
      </ProvidedInterfaces>
      <RequiredInterfaces>
        <Interface name="INeck" />
        <Interface name="IEyes" />
	<Interface name="IFrameEventPublisher" />
      </RequiredInterfaces>
    </Component>
	

    <Component id="idVoiceStartSpark"  type="VoiceStartSpark" plugin="libVoiceStartSpark.so">
      <ProvidedInterfaces>
	<Interface name="IControlVoice" />	
      </ProvidedInterfaces>
      <RequiredInterfaces>
        <Interface name="IVoice" />
	<Interface name="IFaceExpression" />
	<Interface name="IFrameEventPublisher" />
      </RequiredInterfaces>
    </Component>


     <Component id="idAVInputSpark"  type="AVInputSpark" plugin="libAVInputSpark.so">
      <ProvidedInterfaces>
        <Interface name="IConcurrent" />
      </ProvidedInterfaces>
	
      <RequiredInterfaces>
        <Interface name="IAsyncFatalErrorHandler" />
	<Interface name="IAudioConsumer" />
	<Interface name="IVideoConsumer" />
      </RequiredInterfaces>
    </Component>

    <Component id="idFaceTrackerSpark"  type="FaceTrackerThreadSpark" plugin="libFaceTrackerSpark.so">
      <ProvidedInterfaces>
        <Interface name="IVideoConsumer" />
	<Interface name="IConcurrent" />
      </ProvidedInterfaces>
	
      <RequiredInterfaces>
        <Interface name="IDetectedFacePositionConsumer" />
	<Interface name="IAsyncFatalErrorHandler" />
      </RequiredInterfaces>
    </Component>

	 <Component id="idAudioConsumerSpark"  type="AudioConsumerSpark" plugin="libAudioConsumerSpark.so">
      <ProvidedInterfaces>
        <Interface name="IAudioConsumer" />
      </ProvidedInterfaces>
	
      <RequiredInterfaces>
      </RequiredInterfaces>
    </Component>


     <Component id="idCameraControl"  type="CameraControlSpark" plugin="libCameraControlSpark.so">
      <RequiredInterfaces>
        <Interface name="ICamera" />
	<Interface name="IFrameEventPublisher" />
      </RequiredInterfaces>
    </Component>
	
	
  </ComponentDeclarations>
  
  
  <!-- APPLICATION DESCRIPTION -->
  <ApplicationDescription applicationComponent="instanceRemoteCharacterEmbodiment3DSpark" applicationConfig="/generalConf.ini">
    <!-- Paso 1/2: Instantiate components -->
    <ComponentInstances>
      
	  <Instance instanceName="instanceAudioConsumerSpark" componentID ="idAudioConsumerSpark"/>

	  <Instance instanceName="instanceAVInputSpark" componentID ="idAVInputSpark" configuration="/AVInputSpark.ini"/>

	  <Instance instanceName="instanceFaceTrackerSpark" componentID ="idFaceTrackerSpark" configuration="/FaceTrackerSpark.ini"/>
	  <Instance instanceName="instanceRemoteCharacterEmbodiment3DSpark" componentID ="idRemoteCharacterEmbodiment3DSpark" configuration="/RemoteCharacterEmbodiment3DSpark.ini"/>
	  
	   <Instance instanceName="instanceEyeContactSpark" componentID ="idEyeContactSpark" configuration="/EyeContactSpark.ini"/>
	  
	  <Instance instanceName="instanceRemoteFliteVoiceSpark" componentID ="idRemoteFliteVoiceSpark"/>

	  <Instance instanceName="instanceVoiceStartSpark" componentID ="idVoiceStartSpark" configuration="/VoiceStartSpark.ini"/>
	  <Instance instanceName="instanceCameraControl" componentID ="idCameraControl" configuration="/CameraControlSpark.ini"/>
	  	  
    </ComponentInstances>
    
    <!-- Paso 2/2: Connect interfaces -->
    <InterfaceConnections>
	  
	  <Connect interface="IEyes" providedBy="instanceRemoteCharacterEmbodiment3DSpark" requiredBy="instanceEyeContactSpark" />
	  <Connect interface="INeck" providedBy="instanceRemoteCharacterEmbodiment3DSpark" requiredBy="instanceEyeContactSpark" />
	  <Connect interface="IAudioQueue" providedBy="instanceRemoteFliteVoiceSpark" requiredBy="instanceRemoteCharacterEmbodiment3DSpark" />
	  

		<Connect interface="IControlVoice" providedBy="instanceVoiceStartSpark" requiredBy="instanceRemoteCharacterEmbodiment3DSpark" />


	 <Connect interface="IFaceExpression" providedBy="instanceRemoteCharacterEmbodiment3DSpark" 		     requiredBy="instanceVoiceStartSpark" />

	<Connect interface="IVoice" providedBy="instanceRemoteFliteVoiceSpark" requiredBy="instanceVoiceStartSpark" />
	<Connect interface="ICamera" providedBy="instanceRemoteCharacterEmbodiment3DSpark" requiredBy="instanceCameraControl" />
	  

	<Connect interface="IVideoConsumer" providedBy="instanceFaceTrackerSpark" requiredBy="instanceAVInputSpark" />
	  <Connect interface="IAudioConsumer" providedBy="instanceAudioConsumerSpark" requiredBy="instanceAVInputSpark" />
	<Connect interface="IDetectedFacePositionConsumer" providedBy="instanceEyeContactSpark" requiredBy="instanceFaceTrackerSpark" />
	
  
      <ConnectAll interface="IAsyncFatalErrorHandler" providedBy="instanceRemoteCharacterEmbodiment3DSpark"/>
      <ConnectAll interface="IFrameEventPublisher" providedBy="instanceRemoteCharacterEmbodiment3DSpark"/>
    </InterfaceConnections>
  </ApplicationDescription>
</ComponentNetwork>
